País,Felicidad,PIB per cápita (USD PPA),Religión predominante,Derechos LGTBIQ+
Finlandia,7.74,65067,Cristianismo (luteranismo),"Legalización del matrimonio igualitario, leyes contra la discriminación"
Dinamarca,7.58,76687,Cristianismo (luteranismo),"Legalización del matrimonio igualitario, leyes contra la discriminación"
Islandia,7.53,77567,Cristianismo (luteranismo),"Legalización del matrimonio igualitario, leyes contra la discriminación"
Afganistán,1.86,645,Islam (sunita),"Ilegal, castigado con pena de muerte"
Líbano,2.39,1417,Diversidad religiosa (musulmanes y cristianos),"Ilegal según el artículo 534, estigmatización social"
Sierra Leona,3.14,670,Islam y cristianismo,"Ilegal, enfrentan discriminación significativa"
